{
  "$schema": "https://json-schema.org/draft/2020-12/schema",
  "$id": "https://plugins.nginxui.com/schema/entry.schema.json",
  "title": "Plugin Catalog Entry",
  "description": "One plugin as authored in plugins/<id>.json: what it is, where it is released and the versions that are yanked. scripts/build-catalog.mjs adds the releases from the GitHub Releases of repository_url to build the catalog entry that the catalog schema of nginxui/plugin-spec describes.",
  "type": "object",
  "additionalProperties": false,
  "required": [
    "id",
    "name",
    "author",
    "repository_url",
    "trust"
  ],
  "properties": {
    "id": {
      "$ref": "#/$defs/pluginId"
    },
    "name": {
      "$ref": "#/$defs/localizedText",
      "description": "The listed name by language, en required. An official entry takes the languages it does not set from the plugin.json of the release it is listed with. Any other entry shows only the names set here: a name its plugin.json adds or changes, English included, waits for a maintainer, see scripts/ci/names.mjs."
    },
    "description": {
      "$ref": "#/$defs/localizedText",
      "description": "Overrides the description of the plugin.json of the release the entry is listed with, per language."
    },
    "author": {
      "type": "string",
      "minLength": 1,
      "maxLength": 200
    },
    "author_public_key": {
      "type": "string",
      "description": "Minisign public key (text form) that signs plugin.sums in the packages of a community entry. Required when trust is \"community\".",
      "minLength": 1
    },
    "homepage_url": {
      "$ref": "#/$defs/httpsUrl",
      "description": "Overrides homepage_url of the plugin.json of the release the entry is listed with."
    },
    "repository_url": {
      "$ref": "#/$defs/httpsUrl"
    },
    "readme_url": {
      "$ref": "#/$defs/httpsUrl",
      "description": "Overrides README.md at the tag of the release the entry is listed with."
    },
    "icon_url": {
      "$ref": "#/$defs/httpsUrl",
      "description": "Overrides the icon inside the package of the release the entry is listed with, which the catalog serves."
    },
    "screenshots": {
      "type": "array",
      "description": "Overrides the screenshots of the plugin.json of the release the entry is listed with. Images of the plugin in use, in display order. PNG, JPEG or WebP, about 16:10 at 1280 to 1920 pixels wide.",
      "maxItems": 8,
      "items": {
        "$ref": "#/$defs/screenshot"
      }
    },
    "store": {
      "$ref": "#/$defs/store"
    },
    "categories": {
      "type": "array",
      "description": "Where the marketplace files the plugin, one to three ids. Hosts translate the ids.",
      "minItems": 1,
      "maxItems": 3,
      "items": {
        "$ref": "#/$defs/category"
      },
      "uniqueItems": true
    },
    "capabilities": {
      "type": "array",
      "items": {
        "type": "string",
        "minLength": 1,
        "maxLength": 64
      },
      "uniqueItems": true
    },
    "license": {
      "type": "string",
      "minLength": 1,
      "maxLength": 100,
      "description": "SPDX license identifier of the plugin's own source (e.g. MIT, Apache-2.0, AGPL-3.0-only)."
    },
    "trust": {
      "$ref": "#/$defs/trust"
    },
    "revoked_signers": {
      "type": "array",
      "description": "Ids of the signing keys the author withdrew. A release one of them signed is yanked, and hosts treat the packages it signed as unsigned.",
      "items": {
        "type": "string",
        "pattern": "^[0-9A-F]{16}$"
      },
      "uniqueItems": true
    },
    "yanked": {
      "type": "array",
      "items": {
        "$ref": "#/$defs/semver"
      },
      "uniqueItems": true,
      "description": "Versions that are withdrawn. The catalog keeps them marked yanked and hosts no longer offer them."
    }
  },
  "$defs": {
    "category": {
      "type": "string",
      "enum": [
        "certificates",
        "dns",
        "security",
        "traffic",
        "monitoring",
        "logs",
        "analytics",
        "notifications",
        "backup",
        "ai",
        "templates",
        "languages",
        "integrations",
        "tools"
      ]
    },
    "pluginId": {
      "type": "string",
      "pattern": "^[a-z0-9]+(\\.[a-z0-9-]+)+$",
      "maxLength": 64,
      "description": "Reverse-DNS style id. com.nginxui.* is reserved for official plugins; authors without a domain use io.github.<owner>.<name>."
    },
    "locale": {
      "type": "string",
      "pattern": "^[a-z]{2,3}(_[A-Z]{2})?$",
      "description": "BCP-47-ish locale key as used by nginx-ui's gettext catalogs, e.g. \"en\", \"zh_CN\", \"zh_TW\", \"ja_JP\"."
    },
    "localizedText": {
      "type": "object",
      "description": "Locale code to translated string. \"en\" is required as the fallback nginx-ui always falls back to.",
      "required": [
        "en"
      ],
      "minProperties": 1,
      "propertyNames": {
        "$ref": "#/$defs/locale"
      },
      "additionalProperties": {
        "type": "string",
        "minLength": 1
      }
    },
    "screenshot": {
      "type": "object",
      "additionalProperties": false,
      "required": [
        "url"
      ],
      "properties": {
        "url": {
          "$ref": "#/$defs/httpsUrl"
        },
        "dark_url": {
          "$ref": "#/$defs/httpsUrl",
          "description": "The same view in the dark theme, at the size of url. Hosts show url when it is absent."
        },
        "caption": {
          "$ref": "#/$defs/localizedText"
        }
      }
    },
    "httpsUrl": {
      "type": "string",
      "format": "uri",
      "pattern": "^https://"
    },
    "trust": {
      "type": "string",
      "enum": [
        "official",
        "verified",
        "community"
      ],
      "description": "Trust level the entry claims. official: published by the nginx-ui project. verified: published by a partner organization the maintainers vouch for, with a partner certificate in the package or a listing in the partner keyring (v1/partners.json), with no claim about source review. community: signed by the author with author_public_key. The host derives the effective level from the key that signed plugin.sums inside the package."
    },
    "semver": {
      "type": "string",
      "pattern": "^(0|[1-9]\\d*)\\.(0|[1-9]\\d*)\\.(0|[1-9]\\d*)(?:-((?:0|[1-9]\\d*|\\d*[a-zA-Z-][0-9a-zA-Z-]*)(?:\\.(?:0|[1-9]\\d*|\\d*[a-zA-Z-][0-9a-zA-Z-]*))*))?(?:\\+([0-9a-zA-Z-]+(?:\\.[0-9a-zA-Z-]+)*))?$",
      "description": "Semantic Versioning 2.0.0, matching internal/plugin.semverPattern in nginx-ui."
    },
    "store": {
      "description": "Where the store document of the plugin lives: its names, descriptions, homepage and screenshots, as schema/store.schema.json describes. Absent, they come from the plugin.json of the listed release. Fields set in this entry take precedence over the document, and the document over plugin.json. Reserved for the developer portal; the build does not read it yet.",
      "oneOf": [
        {
          "type": "object",
          "additionalProperties": false,
          "required": [
            "source",
            "follow"
          ],
          "properties": {
            "source": {
              "const": "repo",
              "description": "plugin.store.json in the plugin repository, with the screenshots it names in the same repository."
            },
            "follow": {
              "enum": [
                "branch",
                "release"
              ],
              "description": "branch: the default branch, resolved to a commit by each build, so an edit goes live without a release. release: the tag of the listed release, so screenshots of unreleased features stay off the listing."
            }
          }
        },
        {
          "type": "object",
          "additionalProperties": false,
          "required": [
            "source"
          ],
          "properties": {
            "source": {
              "const": "catalog",
              "description": "store/<id>/store.json and store/<id>/README.md in this repository, with screenshots uploaded through the developer portal. For plugins without a public repository."
            }
          }
        }
      ]
    }
  }
}
