{
  "id": "io.github.hintay.hello",
  "name": {
    "en": "Hello Templates",
    "zh_CN": "Hello 配置模板",
    "ko_KR": "Hello 템플릿",
    "ja_JP": "Hello テンプレート",
    "es": "Plantillas Hello"
  },
  "author": "Hintay",
  "author_public_key": "RWQ+8Cm/aigr5eJbmeXC835X6OnB9I07WAWwB9DF1g3xTqEDtoFsCVR0",
  "repository_url": "https://github.com/Hintay/nginx-ui-plugin-hello",
  "categories": [
    "templates",
    "notifications"
  ],
  "license": "MIT",
  "trust": "community",
  "store": {
    "source": "catalog"
  }
}
